{
  "version": "2026-05-17",
  "registry_name": "Hermes Japan job-hunt source registry",
  "human_review_required": true,
  "submission_boundary": [
    "Do not submit by default.",
    "Stop before final submission.",
    "Explicit human approval is required before any submit action."
  ],
  "default_thresholds": {
    "min_fit_score_for_notification": 75,
    "min_fit_score_for_auto_material_suggestion": 82
  },
  "sources": [
    {
      "source_id": "wantedly_ai_ml_intern_japan",
      "source_name": "Wantedly AI/ML internship search in Japan",
      "source_type": "job_board_search",
      "enabled": true,
      "fetch_mode": "manual_snapshot",
      "url": "data/raw_jobs/manual_inbox/wantedly/",
      "platform_id": "wantedly",
      "priority": 1,
      "cadence": "manual_snapshot_first_then_scheduled_review",
      "tags": [
        "internship",
        "japan",
        "ai",
        "machine-learning",
        "wantedly"
      ],
      "keywords": [
        "AI",
        "機械学習",
        "Machine Learning",
        "LLM",
        "Computer Vision",
        "Intern",
        "インターン"
      ],
      "negative_keywords": [
        "sales",
        "営業",
        "designer",
        "デザイナー"
      ],
      "locations": [
        "Japan",
        "Tokyo",
        "Fukuoka",
        "Remote"
      ],
      "min_fit_score_for_notification": 75,
      "notes": [
        "Start with user-provided/manual snapshots under data/raw_jobs/manual_inbox/wantedly/ because Wantedly often requires account/session context.",
        "Do not store Wantedly credentials.",
        "Do not bypass login walls, bot detection, or JavaScript restrictions."
      ],
      "safety": {
        "requires_login": true,
        "stores_credentials": false,
        "allows_auto_apply": false,
        "respect_robots_and_terms": true,
        "manual_review_before_notification": true
      }
    },
    {
      "source_id": "preferred_networks_internship",
      "source_name": "Preferred Networks internship careers page",
      "source_type": "company_careers",
      "enabled": true,
      "fetch_mode": "public_url_html",
      "url": "https://www.preferred.jp/ja/careers/internship/",
      "platform_id": "company_careers",
      "priority": 1,
      "cadence": "daily_or_weekly",
      "tags": [
        "internship",
        "japan",
        "llm",
        "research",
        "pfn"
      ],
      "keywords": [
        "PLaMo",
        "LLM",
        "深層学習",
        "機械学習",
        "インターン",
        "研究"
      ],
      "negative_keywords": [],
      "locations": [
        "Japan",
        "Tokyo",
        "Remote"
      ],
      "min_fit_score_for_notification": 78,
      "notes": [
        "Public careers page source.",
        "Prefer polite rate limits and snapshot logging."
      ],
      "safety": {
        "requires_login": false,
        "stores_credentials": false,
        "allows_auto_apply": false,
        "respect_robots_and_terms": true,
        "manual_review_before_notification": true
      }
    },
    {
      "source_id": "ntt_labs_internship_ai",
      "source_name": "NTT Labs internship AI themes page",
      "source_type": "company_careers",
      "enabled": true,
      "fetch_mode": "public_url_html",
      "url": "https://www.ntt-labs.jp/saiyo/internship/theme2/",
      "platform_id": "company_careers",
      "priority": 1,
      "cadence": "daily_or_weekly",
      "tags": [
        "internship",
        "japan",
        "research",
        "alignment",
        "agent",
        "ntt"
      ],
      "keywords": [
        "生成モデル",
        "Alignment",
        "LLM",
        "AIエージェント",
        "検索基盤",
        "インターン"
      ],
      "negative_keywords": [],
      "locations": [
        "Japan",
        "Tokyo",
        "Remote"
      ],
      "min_fit_score_for_notification": 78,
      "notes": [
        "Public internship theme source.",
        "Themes may change seasonally; registry validation does not guarantee current availability."
      ],
      "safety": {
        "requires_login": false,
        "stores_credentials": false,
        "allows_auto_apply": false,
        "respect_robots_and_terms": true,
        "manual_review_before_notification": true
      }
    },
    {
      "source_id": "rakuten_engineering_internship",
      "source_name": "Rakuten engineering internship/career source",
      "source_type": "company_careers",
      "enabled": true,
      "fetch_mode": "public_url_html",
      "url": "https://corp.rakuten.co.jp/careers/",
      "platform_id": "company_careers",
      "priority": 2,
      "cadence": "weekly",
      "tags": [
        "internship",
        "japan",
        "engineering",
        "rakuten"
      ],
      "keywords": [
        "Developer",
        "AI",
        "Machine Learning",
        "Backend",
        "Internship",
        "Engineering"
      ],
      "negative_keywords": [
        "sales",
        "marketing"
      ],
      "locations": [
        "Japan",
        "Tokyo",
        "Fukuoka"
      ],
      "min_fit_score_for_notification": 72,
      "notes": [
        "Public careers index source; event-specific application forms still require supervised manual review.",
        "Email submission paths should be handled by existing supervised review and approval flow."
      ],
      "safety": {
        "requires_login": false,
        "stores_credentials": false,
        "allows_auto_apply": false,
        "respect_robots_and_terms": true,
        "manual_review_before_notification": true
      }
    },
    {
      "source_id": "mercari_new_graduate_engineering",
      "source_name": "Mercari students and new graduates engineering source",
      "source_type": "company_careers",
      "enabled": true,
      "fetch_mode": "public_url_html",
      "url": "https://careers.mercari.com/en/new-graduates/",
      "platform_id": "company_careers",
      "priority": 2,
      "cadence": "daily_or_weekly",
      "tags": [
        "internship",
        "new-graduate",
        "japan",
        "software-engineering",
        "mercari"
      ],
      "keywords": [
        "Software Engineer",
        "Engineering",
        "Internship",
        "AI",
        "Backend",
        "Machine Learning",
        "New Graduate"
      ],
      "negative_keywords": [
        "sales",
        "marketing",
        "designer"
      ],
      "locations": [
        "Japan",
        "Tokyo",
        "Remote"
      ],
      "min_fit_score_for_notification": 72,
      "notes": [
        "Official students/new-graduates page; public fetch only.",
        "Some role-specific listings may be dynamic, so keep manual review before action."
      ],
      "safety": {
        "requires_login": false,
        "stores_credentials": false,
        "allows_auto_apply": false,
        "respect_robots_and_terms": true,
        "manual_review_before_notification": true
      }
    },
    {
      "source_id": "lycorp_engineer_internship",
      "source_name": "LY Corporation engineer internship source",
      "source_type": "company_careers",
      "enabled": true,
      "fetch_mode": "public_url_html",
      "url": "https://www.lycorp.co.jp/en/recruit/newgrads/internship/engineer/",
      "platform_id": "company_careers",
      "priority": 1,
      "cadence": "daily_or_weekly",
      "tags": [
        "internship",
        "japan",
        "software-engineering",
        "ai",
        "lycorp"
      ],
      "keywords": [
        "Software Engineer",
        "Engineer",
        "Internship",
        "AI",
        "Data",
        "Backend",
        "Hackathon",
        "Job-Based Program"
      ],
      "negative_keywords": [
        "sales",
        "marketing"
      ],
      "locations": [
        "Japan",
        "Tokyo",
        "Fukuoka",
        "Remote"
      ],
      "min_fit_score_for_notification": 72,
      "notes": [
        "Official engineering internship page; public fetch only.",
        "Course details may change seasonally and must be reviewed before action."
      ],
      "safety": {
        "requires_login": false,
        "stores_credentials": false,
        "allows_auto_apply": false,
        "respect_robots_and_terms": true,
        "manual_review_before_notification": true
      }
    },
    {
      "source_id": "cyberagent_engineer_internship",
      "source_name": "CyberAgent engineering internship source",
      "source_type": "company_careers",
      "enabled": true,
      "fetch_mode": "public_url_html",
      "url": "https://www.cyberagent.co.jp/careers/students/tech/internship_b/",
      "platform_id": "company_careers",
      "priority": 2,
      "cadence": "daily_or_weekly",
      "tags": [
        "internship",
        "japan",
        "machine-learning",
        "data-science",
        "cyberagent"
      ],
      "keywords": [
        "機械学習",
        "データサイエンス",
        "AI",
        "エンジニア",
        "インターンシップ",
        "Machine Learning",
        "Data Science"
      ],
      "negative_keywords": [
        "sales",
        "marketing",
        "designer",
        "営業"
      ],
      "locations": [
        "Japan",
        "Tokyo",
        "Osaka",
        "Remote"
      ],
      "min_fit_score_for_notification": 72,
      "notes": [
        "Official student engineering internship page; public fetch only.",
        "Includes mission-type and machine-learning/data-science internship listings when open."
      ],
      "safety": {
        "requires_login": false,
        "stores_credentials": false,
        "allows_auto_apply": false,
        "respect_robots_and_terms": true,
        "manual_review_before_notification": true
      }
    },
    {
      "source_id": "cybozu_engineer_internship",
      "source_name": "Cybozu engineer internship source",
      "source_type": "company_careers",
      "enabled": true,
      "fetch_mode": "public_url_html",
      "url": "https://cybozu.co.jp/company/job/recruitment/intern/",
      "platform_id": "company_careers",
      "priority": 3,